{
  "telemetry_version": 1,
  "event_id": "20260920T061823Z-b84f44",
  "event_type": "external_execution",
  "recorded_at": "2026-09-20T06:18:23.123321Z",
  "task_id": "PROGRAM-001B",
  "run_id": null,
  "actor": "DeepSeek V4.1 Flash",
  "actor_kind": "model",
  "attestation_source": "human",
  "environment": {
    "models_sha256": "06646ed183433b8e6cebc68a257f55d02aeb6b41e8cd3b53ad8717544027fda4",
    "agentflow_sha256": "e14c5668d2f6645fba827c26f77e8e37094e5c5d4d3c9d936e33d6ca60d50727"
  },
  "supersedes_event_id": null,
  "artifact_refs": [],
  "roles": [
    "reviewer"
  ],
  "model": {
    "provider": null,
    "model_id": "DeepSeek V4.1 Flash",
    "variant": null
  },
  "session_type": "fresh",
  "timing": {
    "started_at": null,
    "finished_at": null,
    "timing_source": "unknown"
  },
  "outcome": {
    "verdict": "REWORK",
    "summary": "PROGRAM-001B final independent review: 0 BLOCKER, 1 HIGH, 2 MEDIUM. Found staged-rename scope escape reaching HUMAN_GATE, branch/detached continuity blind spot, and missing B-mode architect signal. All previous correction findings remained closed; 423/423 tests PASS and S1-S6 killed."
  },
  "usage": {
    "token_source": "unavailable",
    "tokens": {
      "in": null,
      "out": null,
      "reasoning": null,
      "cached": null
    },
    "cost": {
      "source": "unavailable",
      "value": null,
      "currency": null
    }
  },
  "note": "Review footer: DeepSeek V4.1 Flash, 11m35s. Additional open risk: integrated reviewer accumulated diff omits staged changes. Review integrity CLEAN. READY_FOR_HUMAN_GATE NO."
}
