{
  "telemetry_version": 1,
  "event_id": "20260920T005937Z-843ad4",
  "event_type": "external_execution",
  "recorded_at": "2026-09-20T00:59:37.510472Z",
  "task_id": "OPT-001",
  "run_id": null,
  "actor": "Muse Spark 1.3 Free",
  "actor_kind": "model",
  "attestation_source": "human",
  "environment": {
    "models_sha256": "06646ed183433b8e6cebc68a257f55d02aeb6b41e8cd3b53ad8717544027fda4",
    "agentflow_sha256": "4dc6dab932d0d45eafc38bae803bd4a77e6cd9ffa5cdd034ac57dcf80c8b6895"
  },
  "supersedes_event_id": null,
  "artifact_refs": [],
  "roles": [
    "worker"
  ],
  "model": {
    "provider": null,
    "model_id": "Muse Spark 1.3 Free",
    "variant": null
  },
  "session_type": "fresh",
  "timing": {
    "started_at": null,
    "finished_at": null,
    "timing_source": "unknown"
  },
  "outcome": {
    "verdict": "PASS",
    "summary": "Bounded correction completed: 3 MEDIUM and 1 LOW from independent review closed; OPT-001 64/64 and full suite 321/321 PASS; ready for final review."
  },
  "usage": {
    "token_source": "unavailable",
    "tokens": {
      "in": null,
      "out": null,
      "reasoning": null,
      "cached": null
    },
    "cost": {
      "source": "unavailable",
      "value": null,
      "currency": null
    }
  },
  "note": "Muse performed the bounded correction after Agy/Gemini 3.8 Flash review event 20260920T003950Z-b7cab2. No commit or push performed."
}
