{
  "telemetry_version": 1,
  "event_id": "20260920T003950Z-b7cab2",
  "event_type": "external_execution",
  "recorded_at": "2026-09-20T00:39:50.183223Z",
  "task_id": "OPT-001",
  "run_id": null,
  "actor": "Agy — Gemini 3.8 Flash",
  "actor_kind": "model",
  "attestation_source": "human",
  "environment": {
    "models_sha256": "06646ed183433b8e6cebc68a257f55d02aeb6b41e8cd3b53ad8717544027fda4",
    "agentflow_sha256": "9807bd74a29115fa6ce729e3786d83b51d5c2e59eed43a1f42e83aeb2ce04e04"
  },
  "supersedes_event_id": null,
  "artifact_refs": [],
  "roles": [
    "reviewer"
  ],
  "model": {
    "provider": "antigravity",
    "model_id": "gemini-3.8-flash",
    "variant": "high"
  },
  "session_type": "fresh",
  "timing": {
    "started_at": null,
    "finished_at": null,
    "timing_source": "unknown"
  },
  "outcome": {
    "verdict": "PASS",
    "summary": "Independent adversarial review PASS: 0 BLOCKER, 0 HIGH, 3 MEDIUM, 1 LOW; 309/309 tests PASS; bounded correction required before final review."
  },
  "usage": {
    "token_source": "unavailable",
    "tokens": {
      "in": null,
      "out": null,
      "reasoning": null,
      "cached": null
    },
    "cost": {
      "source": "unavailable",
      "value": null,
      "currency": null
    }
  },
  "note": "Review executed through Agy/Antigravity CLI. Report title said DEEPSEEK due to prompt wording, but observed runtime model was Gemini 3.8 Flash high. Mutation probes exposed two test-sensitivity gaps."
}
