{
  "telemetry_version": 1,
  "event_id": "20260920T060006Z-dc7a6e",
  "event_type": "external_execution",
  "recorded_at": "2026-09-20T06:00:06.331584Z",
  "task_id": "PROGRAM-001B",
  "run_id": null,
  "actor": "Muse Spark 1.3 Free",
  "actor_kind": "model",
  "attestation_source": "human",
  "environment": {
    "models_sha256": "06646ed183433b8e6cebc68a257f55d02aeb6b41e8cd3b53ad8717544027fda4",
    "agentflow_sha256": "e14c5668d2f6645fba827c26f77e8e37094e5c5d4d3c9d936e33d6ca60d50727"
  },
  "supersedes_event_id": null,
  "artifact_refs": [],
  "roles": [
    "worker"
  ],
  "model": {
    "provider": null,
    "model_id": "Muse Spark 1.3 Free",
    "variant": null
  },
  "session_type": "fresh",
  "timing": {
    "started_at": null,
    "finished_at": null,
    "timing_source": "unknown"
  },
  "outcome": {
    "verdict": "PASS",
    "summary": "PROGRAM-001B bounded correction complete: independent review HIGH/MEDIUM/LOW findings closed; final preservation now verifies Git worktree registration; test-sensitivity gaps closed; 55/55 focused and 423/423 full suite PASS; six targeted source mutations killed."
  },
  "usage": {
    "token_source": "unavailable",
    "tokens": {
      "in": null,
      "out": null,
      "reasoning": null,
      "cached": null
    },
    "cost": {
      "source": "unavailable",
      "value": null,
      "currency": null
    }
  },
  "note": "Correction session footer: Muse Spark 1.3 Free, 18m41s. Closed worktree-registration preservation gap, immutable completed-history sensitivity, multi-child review context, deterministic crash-order assertion, final-review blocking coverage, post-correction validator sensitivity, findings schema parity, and README artifact documentation. No commit, push, PR, or real provider invocation."
}
