{
  "telemetry_version": 1,
  "event_id": "20260920T161317Z-4f7623",
  "event_type": "external_execution",
  "recorded_at": "2026-09-20T16:13:17.525594Z",
  "task_id": "AUTONOMY-001",
  "run_id": null,
  "actor": "GPT-5.6 Sol High",
  "actor_kind": "model",
  "attestation_source": "human",
  "environment": {
    "models_sha256": "06646ed183433b8e6cebc68a257f55d02aeb6b41e8cd3b53ad8717544027fda4",
    "agentflow_sha256": "27490fdc86a929db8a6b220f6191d08ef15da7ef27339f6f9bae10bdef495051"
  },
  "supersedes_event_id": null,
  "artifact_refs": [],
  "roles": [
    "worker"
  ],
  "model": {
    "provider": null,
    "model_id": "gpt-5.6-sol",
    "variant": "high"
  },
  "session_type": "fresh",
  "timing": {
    "started_at": null,
    "finished_at": null,
    "timing_source": "unknown"
  },
  "outcome": {
    "verdict": "PASS",
    "summary": "AUTONOMY-001 bounded correction R1 closed 1 HIGH, 3 MEDIUM and LOW-2: identity-safe queue subprocess handling, explicit quiescence evidence, real executor integration coverage, immutable global deadline coverage, and Git/Human-Gate preservation regressions. AUTONOMY 86/86 and full suite 524/524 PASS."
  },
  "usage": {
    "token_source": "unavailable",
    "tokens": {
      "in": null,
      "out": null,
      "reasoning": null,
      "cached": null
    },
    "cost": {
      "source": "unavailable",
      "value": null,
      "currency": null
    }
  },
  "note": "Stress repro 480 executions produced 0 spurious INTERNAL_ERROR and 0 unrelated signals. Previously surviving Q1/Q11/Q12/Q15/Q19/Q20/A2/A3/A8/A9 are now killed by repository tests. LOW-1 durable recovery-denial diagnostics intentionally deferred."
}
