{
  "telemetry_version": 1,
  "event_id": "20260920T080954Z-9d1feb",
  "event_type": "external_execution",
  "recorded_at": "2026-09-20T08:09:54.430618Z",
  "task_id": "AUTONOMY-001",
  "run_id": null,
  "actor": "GPT-5.6 Sol High",
  "actor_kind": "model",
  "attestation_source": "human",
  "environment": {
    "models_sha256": "06646ed183433b8e6cebc68a257f55d02aeb6b41e8cd3b53ad8717544027fda4",
    "agentflow_sha256": "239c82a0e1ae39a2fc39e08d5e2940621b2e2a301560b60fb4148c6893f7902b"
  },
  "supersedes_event_id": null,
  "artifact_refs": [],
  "roles": [
    "worker"
  ],
  "model": {
    "provider": null,
    "model_id": "gpt-5.6-sol",
    "variant": "high"
  },
  "session_type": "fresh",
  "timing": {
    "started_at": null,
    "finished_at": null,
    "timing_source": "unknown"
  },
  "outcome": {
    "verdict": "PASS",
    "summary": "AUTONOMY-001 complete integrated implementation: sequential multi-program queue, controlled retry, automatic fallback, global budgets, ProgramOutcome boundary, provider classification, queue-only ExecutionControl; 63/63 focused and 501/501 full suite PASS."
  },
  "usage": {
    "token_source": "unavailable",
    "tokens": {
      "in": null,
      "out": null,
      "reasoning": null,
      "cached": null
    },
    "cost": {
      "source": "unavailable",
      "value": null,
      "currency": null
    }
  },
  "note": "Implementation session completed in 30m23s. Source-mutation campaign intentionally deferred to independent review. No commit, push, PR, telemetry mutation, real provider invocation, or automatic Git publication."
}
