{
  "telemetry_version": 1,
  "event_id": "20260920T064056Z-733c29",
  "event_type": "external_execution",
  "recorded_at": "2026-09-20T06:40:56.731014Z",
  "task_id": "PROGRAM-001B",
  "run_id": null,
  "actor": "Muse Spark 1.3 Contributor",
  "actor_kind": "model",
  "attestation_source": "human",
  "environment": {
    "models_sha256": "06646ed183433b8e6cebc68a257f55d02aeb6b41e8cd3b53ad8717544027fda4",
    "agentflow_sha256": "d3006e993ae310999d71cc2322c82a3a543c15bf495903cdab786f127159a650"
  },
  "supersedes_event_id": null,
  "artifact_refs": [],
  "roles": [
    "worker"
  ],
  "model": {
    "provider": "OpenCode Go",
    "model_id": "Muse Spark 1.3 Contributor",
    "variant": "xhigh"
  },
  "session_type": "fresh",
  "timing": {
    "started_at": null,
    "finished_at": null,
    "timing_source": "unknown"
  },
  "outcome": {
    "verdict": "PASS",
    "summary": "PROGRAM-001B final bounded correction complete: staged rename scope escape, branch/detached continuity, B-mode architect signaling, and staged integrated-review diff evidence closed; 70/70 focused, 438/438 full suite, R1-R4 and S1-S6 all killed."
  },
  "usage": {
    "token_source": "unavailable",
    "tokens": {
      "in": null,
      "out": null,
      "reasoning": null,
      "cached": null
    },
    "cost": {
      "source": "unavailable",
      "value": null,
      "currency": null
    }
  },
  "note": "Execution began in the same OpenCode session with Muse Spark 1.3 Free and resumed after free quota exhaustion using Muse Spark 1.3 Contributor via OpenCode Go xhigh. Final continuation footer: Muse Spark 1.3 Contributor, 10m54s. No commit, push, PR, telemetry mutation, or real AgentFlow provider invocation."
}
