{
  "telemetry_version": 1,
  "event_id": "20260920T022649Z-e295f1",
  "event_type": "external_execution",
  "recorded_at": "2026-09-20T02:26:49.125957Z",
  "task_id": "WATCHDOG-001A",
  "run_id": null,
  "actor": "Agy — Gemini 3.8 Flash",
  "actor_kind": "model",
  "attestation_source": "human",
  "environment": {
    "models_sha256": "06646ed183433b8e6cebc68a257f55d02aeb6b41e8cd3b53ad8717544027fda4",
    "agentflow_sha256": "a7f2f1af785f4633107d44c0e077e1544635cadbe25fec3ffb2d68f40a7b5ecc"
  },
  "supersedes_event_id": null,
  "artifact_refs": [],
  "roles": [
    "reviewer"
  ],
  "model": {
    "provider": "antigravity",
    "model_id": "gemini-3.8-flash",
    "variant": "high"
  },
  "session_type": "fresh",
  "timing": {
    "started_at": null,
    "finished_at": null,
    "timing_source": "unknown"
  },
  "outcome": {
    "verdict": "REWORK",
    "summary": "Independent adversarial review: 0 BLOCKER, 0 HIGH, 1 MEDIUM, 1 LOW; production WATCHDOG behavior passed, but deterministic timeout-vs-stall precedence test requires correction before final review."
  },
  "usage": {
    "token_source": "unavailable",
    "tokens": {
      "in": null,
      "out": null,
      "reasoning": null,
      "cached": null
    },
    "cost": {
      "source": "unavailable",
      "value": null,
      "currency": null
    }
  },
  "note": "MEDIUM is test determinism only: real-clock microsecond race in simultaneous absolute-timeout vs stall test. LOW is test-only descendant-survivor assertion coupling. Production behavior and mutation probes A-J passed review."
}
