{
  "telemetry_version": 1,
  "event_id": "20260920T035320Z-adda85",
  "event_type": "external_execution",
  "recorded_at": "2026-09-20T03:53:20.594709Z",
  "task_id": "PROGRAM-001B",
  "run_id": null,
  "actor": "GPT-5.6 Sol High",
  "actor_kind": "model",
  "attestation_source": "human",
  "environment": {
    "models_sha256": "06646ed183433b8e6cebc68a257f55d02aeb6b41e8cd3b53ad8717544027fda4",
    "agentflow_sha256": "a7f2f1af785f4633107d44c0e077e1544635cadbe25fec3ffb2d68f40a7b5ecc"
  },
  "supersedes_event_id": null,
  "artifact_refs": [],
  "roles": [
    "architect"
  ],
  "model": {
    "provider": null,
    "model_id": "gpt-5.6-sol",
    "variant": "high"
  },
  "session_type": "fresh",
  "timing": {
    "started_at": null,
    "finished_at": null,
    "timing_source": "unknown"
  },
  "outcome": {
    "verdict": "PASS",
    "summary": "PROGRAM-001B architecture READY: bounded sequential multi-subtask execution, shared isolated worktree, parent-child scope inheritance, durable subtask markers, integrated review/correction, crash-consistent evidence, no retry/fallback/resume."
  },
  "usage": {
    "token_source": "unavailable",
    "tokens": {
      "in": null,
      "out": null,
      "reasoning": null,
      "cached": null
    },
    "cost": {
      "source": "unavailable",
      "value": null,
      "currency": null
    }
  },
  "note": "Architecture refresh plus addendum completed. Addendum clarified child-delta vs accumulated parent scope, immutable historical completion records after integrated correction, and preservation-verdict precedence. READY_FOR_IMPLEMENTATION YES."
}
