{
  "telemetry_version": 1,
  "event_id": "20260920T164653Z-5a0663",
  "event_type": "external_execution",
  "recorded_at": "2026-09-20T16:46:53.308658Z",
  "task_id": "AUTONOMY-001",
  "run_id": null,
  "actor": "Gemini 3.8 Flash High",
  "actor_kind": "model",
  "attestation_source": "human",
  "environment": {
    "models_sha256": "06646ed183433b8e6cebc68a257f55d02aeb6b41e8cd3b53ad8717544027fda4",
    "agentflow_sha256": "27490fdc86a929db8a6b220f6191d08ef15da7ef27339f6f9bae10bdef495051"
  },
  "supersedes_event_id": null,
  "artifact_refs": [],
  "roles": [
    "reviewer"
  ],
  "model": {
    "provider": null,
    "model_id": "gemini-3.8-flash",
    "variant": "high"
  },
  "session_type": "fresh",
  "timing": {
    "started_at": null,
    "finished_at": null,
    "timing_source": "unknown"
  },
  "outcome": {
    "verdict": "PASS",
    "summary": "AUTONOMY-001 final closure review PASS: 0 BLOCKER, 0 HIGH, 0 MEDIUM, 1 LOW acceptable deferred; HIGH-1 and MEDIUM-1/2/3 closed; 86/86 AUTONOMY tests and 524/524 full suite PASS; critical and spot-check mutations killed; stress recheck 480 executions with 0 spurious INTERNAL_ERROR and 0 unrelated signals; review integrity CLEAN; READY_FOR_HUMAN_GATE YES."
  },
  "usage": {
    "token_source": "unavailable",
    "tokens": {
      "in": null,
      "out": null,
      "reasoning": null,
      "cached": null
    },
    "cost": {
      "source": "unavailable",
      "value": null,
      "currency": null
    }
  },
  "note": "LOW-1 intentionally deferred: recovery denial reasons are not durably added to secondary_failures; reviewer found no correctness, execution, or safety defect. Process identity, PID/PGID reuse safety, transient scan handling, descendant handling, quiescence evidence, real executor integration, global deadline, failure precedence, no automatic Git publication, and Human Gate worktree preservation all PASS."
}
