{
  "telemetry_version": 1,
  "event_id": "20260920T020048Z-901162",
  "event_type": "external_execution",
  "recorded_at": "2026-09-20T02:00:48.817072Z",
  "task_id": "WATCHDOG-001A",
  "run_id": null,
  "actor": "Muse Spark 1.3 Free",
  "actor_kind": "model",
  "attestation_source": "human",
  "environment": {
    "models_sha256": "06646ed183433b8e6cebc68a257f55d02aeb6b41e8cd3b53ad8717544027fda4",
    "agentflow_sha256": "a7f2f1af785f4633107d44c0e077e1544635cadbe25fec3ffb2d68f40a7b5ecc"
  },
  "supersedes_event_id": null,
  "artifact_refs": [],
  "roles": [
    "worker"
  ],
  "model": {
    "provider": null,
    "model_id": "Muse Spark 1.3 Free",
    "variant": null
  },
  "session_type": "fresh",
  "timing": {
    "started_at": null,
    "finished_at": null,
    "timing_source": "unknown"
  },
  "outcome": {
    "verdict": "PASS",
    "summary": "WATCHDOG-001A implementation complete: 46/46 focused tests and 367/367 full suite PASS; six mutation probes detected injected regressions; ready for independent review."
  },
  "usage": {
    "token_source": "unavailable",
    "tokens": {
      "in": null,
      "out": null,
      "reasoning": null,
      "cached": null
    },
    "cost": {
      "source": "unavailable",
      "value": null,
      "currency": null
    }
  },
  "note": "Opt-in model inactivity watchdog implemented over OPT-001 supervision seam. No commit, push, PR, or real model provider invocation."
}
